{
  "id": "skill-verifier",
  "name": "skill-verifier",
  "version": "1.0.0",
  "description": "Verifies that skills were applied correctly. Self-audit mechanism that checks process compliance and outcome quality. Ensures required deliverables exist, checklists were completed, and reference documents were consulted. Produces verification report with gaps and remediation actions.",
  "phase": "VERIFY",
  "category": "operations",
  "content": "# Skill Verifier\n\nVerify skills were applied correctly.\n\n## When to Use\n\n- **After applying any skill** â€” Verify before proceeding\n- **At stage gates** â€” Verify all skills in stage\n- **During retrospective** â€” Audit full journey\n- **On suspicion of gaps** â€” When something feels incomplete\n\n## Reference Requirements\n\n**MUST read before applying this skill:**\n\n| Reference | Why Required |\n|-----------|--------------|\n| `verification-checklists.md` | Skill-specific verification checklists |\n\n**Read if applicable:**\n\n| Reference | When Needed |\n|-----------|-------------|\n| The specific skill's SKILL.md | When verifying that skill's application |\n| The specific skill's references | To verify reference utilization |\n\n**Verification:** Produce verification record with PASS/PARTIAL/FAIL status.\n\n## Hook Integration\n\nVerification hooks automate deliverable checking and phase gate validation:\n\n| Hook | Trigger | What it does |\n|------|---------|--------------|\n| `deliverable-checker` | PostToolUse (Skill) | Warns if expected deliverables missing |\n| `phase-gate-check` | PostToolUse (Write/Edit on loop-state.json) | Blocks phase transitions if mandatory skills incomplete |\n\n**Note:** Hooks provide quick automated warnings. This skill performs comprehensive verification with full checklists.\n\nSee `.claude/hooks/deliverable-checker.sh`, `.claude/hooks/phase-gate-check.sh`, and `HOOKS.md` for details.\n\n## Core Concept\n\nSkill Verifier answers: **\"Was this skill applied correctly?\"**\n\nCorrectness has two dimensions:\n\n```\nâ”Œâ”€â”€â”€â”€â”€â”€â”€â”€â”€â”€â”€â”€â”€â”€â”€â”€â”€â”€â”€â”€â”€â”€â”€â”€â”€â”€â”€â”€â”€â”€â”€â”€â”€â”€â”€â”€â”€â”€â”€â”€â”€â”€â”€â”€â”€â”€â”€â”€â”€â”€â”€â”€â”€â”€â”€â”€â”€â”€â”€â”€â”€â”€â”€â”€â”€â”€â”€â”€â”€â”€â”€â”€â”€â”€â”€â”€â”€â”\nâ”‚                         CORRECTNESS DIMENSIONS                               â”‚\nâ”œâ”€â”€â”€â”€â”€â”€â”€â”€â”€â”€â”€â”€â”€â”€â”€â”€â”€â”€â”€â”€â”€â”€â”€â”€â”€â”€â”€â”€â”€â”€â”€â”€â”€â”€â”€â”€â”€â”€â”€â”€â”€â”€â”€â”€â”€â”€â”€â”€â”€â”€â”€â”€â”€â”€â”€â”€â”€â”€â”€â”€â”€â”€â”€â”€â”€â”€â”€â”€â”€â”€â”€â”€â”€â”€â”€â”€â”€â”¤\nâ”‚                                                                             â”‚\nâ”‚  PROCESS COMPLIANCE                    OUTCOME QUALITY                      â”‚\nâ”‚  â”€â”€â”€â”€â”€â”€â”€â”€â”€â”€â”€â”€â”€â”€â”€â”€â”€â”€                    â”€â”€â”€â”€â”€â”€â”€â”€â”€â”€â”€â”€â”€â”€â”€                      â”‚\nâ”‚  â€¢ Did I follow all steps?             â€¢ Did the output achieve its goal?   â”‚\nâ”‚  â€¢ Did I read required references?     â€¢ Is the output complete?            â”‚\nâ”‚  â€¢ Did I produce required deliverable? â€¢ Is the output high quality?        â”‚\nâ”‚  â€¢ Did I complete the checklist?       â€¢ Would a senior approve this?       â”‚\nâ”‚                                                                             â”‚\nâ”‚  Verification checks BOTH dimensions                                        â”‚\nâ”‚                                                                             â”‚\nâ””â”€â”€â”€â”€â”€â”€â”€â”€â”€â”€â”€â”€â”€â”€â”€â”€â”€â”€â”€â”€â”€â”€â”€â”€â”€â”€â”€â”€â”€â”€â”€â”€â”€â”€â”€â”€â”€â”€â”€â”€â”€â”€â”€â”€â”€â”€â”€â”€â”€â”€â”€â”€â”€â”€â”€â”€â”€â”€â”€â”€â”€â”€â”€â”€â”€â”€â”€â”€â”€â”€â”€â”€â”€â”€â”€â”€â”€â”˜\n```\n\n## The Verification Process\n\n```\nâ”Œâ”€â”€â”€â”€â”€â”€â”€â”€â”€â”€â”€â”€â”€â”€â”€â”€â”€â”€â”€â”€â”€â”€â”€â”€â”€â”€â”€â”€â”€â”€â”€â”€â”€â”€â”€â”€â”€â”€â”€â”€â”€â”€â”€â”€â”€â”€â”€â”€â”€â”€â”€â”€â”€â”€â”€â”€â”€â”€â”€â”€â”€â”€â”€â”€â”€â”€â”€â”€â”€â”€â”€â”€â”€â”€â”€â”€â”€â”\nâ”‚                      SKILL VERIFICATION PROCESS                              â”‚\nâ”‚                                                                             â”‚\nâ”‚  1. IDENTIFY SKILL                                                          â”‚\nâ”‚     â””â”€â†’ Which skill was applied?                                            â”‚\nâ”‚     â””â”€â†’ Load skill requirements                                             â”‚\nâ”‚                                                                             â”‚\nâ”‚  2. CHECK PROCESS COMPLIANCE                                                â”‚\nâ”‚     â””â”€â†’ Were all steps followed?                                            â”‚\nâ”‚     â””â”€â†’ Were required references read?                                      â”‚\nâ”‚     â””â”€â†’ Was required deliverable produced?                                  â”‚\nâ”‚     â””â”€â†’ Was checklist completed?                                            â”‚\nâ”‚                                                                             â”‚\nâ”‚  3. CHECK OUTCOME QUALITY                                                   â”‚\nâ”‚     â””â”€â†’ Does deliverable meet minimum requirements?                         â”‚\nâ”‚     â””â”€â†’ Is it complete (no TODOs, no gaps)?                                 â”‚\nâ”‚     â””â”€â†’ Would it pass review?                                               â”‚\nâ”‚                                                                             â”‚\nâ”‚  4. IDENTIFY GAPS                                                           â”‚\nâ”‚     â””â”€â†’ What was missed?                                                    â”‚\nâ”‚     â””â”€â†’ What was incomplete?                                                â”‚\nâ”‚     â””â”€â†’ What needs remediation?                                             â”‚\nâ”‚                                                                             â”‚\nâ”‚  5. PRODUCE REPORT                                                          â”‚\nâ”‚     â””â”€â†’ Verification status (PASS/PARTIAL/FAIL)                             â”‚\nâ”‚     â””â”€â†’ Gaps identified                                                     â”‚\nâ”‚     â””â”€â†’ Remediation actions                                                 â”‚\nâ”‚                                                                             â”‚\nâ”‚  6. REMEDIATE (if needed)                                                   â”‚\nâ”‚     â””â”€â†’ Address gaps                                                        â”‚\nâ”‚     â””â”€â†’ Re-verify                                                           â”‚\nâ”‚                                                                             â”‚\nâ””â”€â”€â”€â”€â”€â”€â”€â”€â”€â”€â”€â”€â”€â”€â”€â”€â”€â”€â”€â”€â”€â”€â”€â”€â”€â”€â”€â”€â”€â”€â”€â”€â”€â”€â”€â”€â”€â”€â”€â”€â”€â”€â”€â”€â”€â”€â”€â”€â”€â”€â”€â”€â”€â”€â”€â”€â”€â”€â”€â”€â”€â”€â”€â”€â”€â”€â”€â”€â”€â”€â”€â”€â”€â”€â”€â”€â”€â”˜\n```\n\n## Required Deliverables Registry\n\nEvery skill MUST produce a named deliverable. This registry defines what each skill produces:\n\n| Skill | Required Deliverable | Location |\n|-------|---------------------|----------|\n| entry-portal | `dream-state.md`, `system-queue.json` | `domain-memory/{domain}/` |\n| memory-manager | Handoff: `sessions/{date}-{system}.md` | `domain-memory/{domain}/sessions/` |\n| spec | `FEATURESPEC.md` | Project root or `specs/` |\n| estimation | `ESTIMATE.md` | Project root |\n| triage | Updated `system-queue.json` | `domain-memory/{domain}/` |\n| git-workflow | Branch created, commits made | Git repository |\n| architect | `ARCHITECTURE.md` or ADRs | Project root or `decisions/` |\n| architecture-review | `ARCHITECTURE-REVIEW.md` | Project root |\n| **infra-database** | `schema.ts`, `db/index.ts`, `repositories/`, `drizzle.config.ts` | `src/lib/server/db/` |\n| **infra-services** | `services/index.ts` with lazy singletons | `src/lib/server/` |\n| **infra-docker** | `Dockerfile`, `docker-compose.yml` (optional) | Project root |\n| **infra-devenv** | `scripts/dev.sh` or `.devcontainer/` | Project root |\n| **infra-monorepo** | `turbo.json` or `pnpm-workspace.yaml` | Monorepo root |\n| scaffold | Project structure created | Project directory |\n| implement | Source code files | `src/` |\n| test-generation | Test files | `tests/` |\n| code-verification | `VERIFICATION.md` | Project root |\n| debug-assist | Bug fix committed | Git repository |\n| code-validation | `VALIDATION.md` | Project root |\n| integration-test | Integration test files | `tests/integration/` |\n| security-audit | Security section in `VALIDATION.md` | Project root |\n| perf-analysis | Performance section in `VALIDATION.md` | Project root |\n| document | `README.md`, API docs | Project root |\n| code-review | `CODE-REVIEW.md` | Project root |\n| refactor | Refactored code + passing tests | `src/` |\n| deploy | `DEPLOY.md` | Project root |\n| journey-tracer | `JOURNEY.md` | Project root |\n| retrospective | `RETROSPECTIVE.md` | `domain-memory/{domain}/` |\n\n## Required References by Skill\n\nEach skill has references that MUST be consulted for proper application:\n\n### entry-portal\n| Reference | When Required |\n|-----------|---------------|\n| `clarifying-questions.md` | Always â€” guides requirement gathering |\n| `system-decomposition.md` | When breaking down large systems |\n| `dream-state-template.md` | Always â€” template for vision document |\n| `queue-operations.md` | When managing system queue |\n\n### spec\n| Reference | When Required |\n|-----------|---------------|\n| `18-section-template.md` | Always â€” defines required sections |\n| `capability-format.md` | Always â€” defines capability structure |\n| `feedback-framework.md` | For UI-heavy features |\n\n### architect\n| Reference | When Required |\n|-----------|---------------|\n| `architecture-patterns.md` | When selecting patterns |\n| `architectural-drivers.md` | When identifying drivers |\n| `adr-template.md` | When documenting decisions |\n\n### architecture-review\n| Reference | When Required |\n|-----------|---------------|\n| `assessment-template.md` | Always â€” defines review structure |\n| `evaluation-dimensions.md` | When scoring against drivers |\n| `common-architecture-issues.md` | When identifying issues |\n| `red-flags-checklist.md` | Always â€” quick issue scan |\n\n### implement\n| Reference | When Required |\n|-----------|---------------|\n| `service-layer-patterns.md` | When writing services |\n| `error-handling-patterns.md` | Always â€” error handling required |\n| `testing-patterns.md` | When writing tests alongside |\n\n### test-generation\n| Reference | When Required |\n|-----------|---------------|\n| `unit-test-patterns.md` | For unit tests |\n| `integration-test-patterns.md` | For integration tests |\n| `mocking-patterns.md` | When using mocks |\n\n### security-audit\n| Reference | When Required |\n|-----------|---------------|\n| `owasp-top-10.md` | Always â€” comprehensive scan |\n| `vulnerability-patterns.md` | Always â€” pattern detection |\n| `remediation-patterns.md` | When fixing issues |\n\n### code-review\n| Reference | When Required |\n|-----------|---------------|\n| `maintainability-checklist.md` | Always â€” quality check |\n| `diff-analysis.md` | For PR reviews |\n| `feedback-formatting.md` | When writing feedback |\n\n## Verification Checklist Template\n\n```markdown\n# Skill Verification: [Skill Name]\n\n**Date:** [Date]\n**System:** [System Name]\n**Verifier:** [Self/Peer]\n\n## Process Compliance\n\n### Steps Completed\n- [ ] Step 1: [Description]\n- [ ] Step 2: [Description]\n- [ ] Step 3: [Description]\n...\n\n### References Consulted\n- [ ] [reference-1.md] â€” [What I learned/applied]\n- [ ] [reference-2.md] â€” [What I learned/applied]\n...\n\n### Deliverable Produced\n- [ ] [Deliverable name] exists at [location]\n- [ ] Deliverable is complete (no TODOs)\n- [ ] Deliverable follows template/format\n\n## Outcome Quality\n\n### Completeness\n- [ ] All required sections present\n- [ ] No placeholder content\n- [ ] All edge cases addressed\n\n### Quality\n- [ ] Would pass senior review\n- [ ] Follows best practices from references\n- [ ] No obvious gaps or issues\n\n## Verification Result\n\n| Dimension | Status | Notes |\n|-----------|--------|-------|\n| Process Compliance | âœ…/âš ï¸/âŒ | |\n| Outcome Quality | âœ…/âš ï¸/âŒ | |\n| **Overall** | **PASS/PARTIAL/FAIL** | |\n\n## Gaps Identified\n\n| Gap | Severity | Remediation |\n|-----|----------|-------------|\n| | | |\n\n## Remediation Actions\n\n1. [ ] [Action 1]\n2. [ ] [Action 2]\n```\n\n## Verification Triggers\n\n| Trigger | Action |\n|---------|--------|\n| Skill application complete | Self-verify before proceeding |\n| Stage gate reached | Verify all skills in stage |\n| Doubt about completeness | Spot verification |\n| Retrospective | Full journey verification |\n\n---\n\n## Gate Verification Integration\n\nSkill Verifier is **mandatory** at phase transitions and gates. Verification BLOCKS progress if it fails.\n\n### Automatic Verification Points\n\n```\nâ”Œâ”€â”€â”€â”€â”€â”€â”€â”€â”€â”€â”€â”€â”€â”€â”€â”€â”€â”€â”€â”€â”€â”€â”€â”€â”€â”€â”€â”€â”€â”€â”€â”€â”€â”€â”€â”€â”€â”€â”€â”€â”€â”€â”€â”€â”€â”€â”€â”€â”€â”€â”€â”€â”€â”€â”€â”€â”€â”€â”€â”€â”€â”€â”€â”€â”€â”€â”€â”€â”€â”€â”€â”€â”€â”€â”€â”€â”€â”\nâ”‚                    VERIFICATION ENFORCEMENT                                  â”‚\nâ”‚                                                                             â”‚\nâ”‚  1. AFTER EACH SKILL                                                        â”‚\nâ”‚     Run: verify [skill]                                                     â”‚\nâ”‚     Check: Deliverable exists and is non-empty                              â”‚\nâ”‚     Action: Log to journey-log.jsonl                                        â”‚\nâ”‚                                                                             â”‚\nâ”‚  2. AT PHASE BOUNDARIES                                                     â”‚\nâ”‚     Run: verify --phase [current-phase]                                     â”‚\nâ”‚     Check: All required skills completed or skipped                         â”‚\nâ”‚     Check: All deliverables exist                                           â”‚\nâ”‚     Action: Block if any verification fails                                 â”‚\nâ”‚                                                                             â”‚\nâ”‚  3. AT GATES (spec, architecture, deploy)                                   â”‚\nâ”‚     Run: verify --gate [gate-name]                                          â”‚\nâ”‚     Check: Phase verification passes                                        â”‚\nâ”‚     Check: Gate-specific quality checks                                     â”‚\nâ”‚     Action: Block transition until all checks pass                          â”‚\nâ”‚                                                                             â”‚\nâ”‚  4. AT SYSTEM COMPLETION                                                    â”‚\nâ”‚     Run: verify --full                                                      â”‚\nâ”‚     Check: All phases verified                                              â”‚\nâ”‚     Check: All deliverables present                                         â”‚\nâ”‚     Check: Journey-log complete                                             â”‚\nâ”‚     Action: Block completion if gaps found                                  â”‚\nâ”‚                                                                             â”‚\nâ””â”€â”€â”€â”€â”€â”€â”€â”€â”€â”€â”€â”€â”€â”€â”€â”€â”€â”€â”€â”€â”€â”€â”€â”€â”€â”€â”€â”€â”€â”€â”€â”€â”€â”€â”€â”€â”€â”€â”€â”€â”€â”€â”€â”€â”€â”€â”€â”€â”€â”€â”€â”€â”€â”€â”€â”€â”€â”€â”€â”€â”€â”€â”€â”€â”€â”€â”€â”€â”€â”€â”€â”€â”€â”€â”€â”€â”€â”˜\n```\n\n### Blocking Behavior\n\nWhen verification fails:\n\n```\nâš ï¸ Verification Failed: [skill/phase/gate]\n\nStatus: BLOCKED\nReason: [specific failure reason]\n\nGaps Found:\n  - [gap 1]\n  - [gap 2]\n\nRemediation Required:\n  1. [action to fix gap 1]\n  2. [action to fix gap 2]\n\nCommands:\n  - Fix issues, then run: verify\n  - To override (not recommended): skip-verify --reason \"...\"\n```\n\n### Phase-Specific Verification\n\n| Phase | Verification Checks |\n|-------|---------------------|\n| INIT | dream-state.md exists, FEATURESPEC.md exists, ESTIMATE.md exists |\n| SCAFFOLD | ARCHITECTURE.md exists, package.json exists, src/ directory exists, **infrastructure checks (if applicable)** |\n| IMPLEMENT | Source files created for current capability |\n| TEST | Test files created for current capability |\n| VERIFY | Build passes, tests pass, no lint errors |\n| VALIDATE | All tests pass, security audit complete, perf analyzed |\n| DOCUMENT | README.md exists and is non-empty |\n| REVIEW | Code review notes exist or PR ready |\n| SHIP | Deployment confirmed or deploy target configured |\n| COMPLETE | RETROSPECTIVE.md exists, calibration.json updated, HANDOFF.md exists |\n\n### Infrastructure Verification (SCAFFOLD Phase)\n\nFor backend/fullstack/api systems, SCAFFOLD phase also verifies:\n\n| Check | What's Verified |\n|-------|-----------------|\n| Database | `schema.ts`, `db/index.ts`, `drizzle.config.ts`, `repositories/` exist |\n| Services | `services/index.ts` exists with lazy singleton pattern |\n| Dependencies | `drizzle-orm`, `better-sqlite3` in package.json |\n| Scripts | `db:push`, `db:generate` scripts defined |\n| Data | `data/` directory exists, `.gitignore` excludes it |\n\nRun `verify-infra` or `.claude/hooks/verify-infrastructure.sh` for comprehensive check.\n\n### Gate-Specific Verification\n\n| Gate | Required Verifications | Quality Checks |\n|------|------------------------|----------------|\n| spec | FEATURESPEC.md exists | Has capabilities section, not empty |\n| architecture | ARCHITECTURE.md exists | Has components section, has decisions |\n| infrastructure | Database schema, repositories, services | (backend/fullstack/api only) |\n| deploy | All prior phases verified | All tests pass, no security criticals |\n\n### Verification Commands\n\n```bash\n# Verify single skill\nverify [skill-name]\n\n# Verify current phase\nverify --phase\n\n# Verify specific gate\nverify --gate [spec|architecture|infrastructure|deploy]\n\n# Verify infrastructure specifically\nverify-infra\n.claude/hooks/verify-infrastructure.sh [system-dir] [--verbose]\n\n# Full system verification\nverify --full\n\n# Show verification status\ncheck-phase\n\n# Skip verification with reason (use sparingly)\nskip-verify [skill] --reason \"explanation\"\nskip-infra --reason \"explanation\"\n```\n\n### Verification Report Format\n\n```json\n{\n  \"timestamp\": \"2026-01-18T12:00:00Z\",\n  \"type\": \"phase\",\n  \"phase\": \"INIT\",\n  \"status\": \"pass|partial|fail\",\n  \"skills\": {\n    \"entry-portal\": { \"status\": \"pass\", \"deliverable\": \"dream-state.md\" },\n    \"requirements\": { \"status\": \"pass\", \"deliverable\": \"FEATURESPEC.md\" },\n    \"spec\": { \"status\": \"pass\", \"deliverable\": \"FEATURESPEC.md\" },\n    \"estimation\": { \"status\": \"fail\", \"reason\": \"ESTIMATE.md not found\" },\n    \"triage\": { \"status\": \"skipped\", \"reason\": \"Single system, no prioritization needed\" },\n    \"memory-manager\": { \"status\": \"pass\", \"deliverable\": \"loop-state.json loaded\" }\n  },\n  \"gaps\": [\n    { \"skill\": \"estimation\", \"gap\": \"Missing ESTIMATE.md\", \"severity\": \"medium\" }\n  ],\n  \"blocking\": true,\n  \"message\": \"Cannot proceed to SCAFFOLD: estimation skill not completed\"\n}\n```\n\n## Integration with Journey Tracer\n\nSkill Verifier produces verification records that feed into the journey tracer:\n\n```json\n{\n  \"skill\": \"architect\",\n  \"timestamp\": \"2025-01-17T10:30:00Z\",\n  \"verification\": {\n    \"processCompliance\": \"pass\",\n    \"outcomeQuality\": \"partial\",\n    \"overall\": \"partial\"\n  },\n  \"referencesRead\": [\n    \"architecture-patterns.md\",\n    \"adr-template.md\"\n  ],\n  \"deliverableProduced\": \"ARCHITECTURE.md\",\n  \"gaps\": [\n    {\n      \"description\": \"No formal ADR created\",\n      \"severity\": \"medium\",\n      \"remediated\": true\n    }\n  ]\n}\n```\n\n## Self-Audit Questions\n\nWhen verifying your own skill application, ask:\n\n### Process Questions\n1. Did I read the SKILL.md completely before starting?\n2. Did I consult the required references?\n3. Did I follow all steps in order?\n4. Did I produce the required deliverable?\n5. Did I complete any checklists in the skill?\n\n### Outcome Questions\n1. Is the deliverable complete?\n2. Would a senior engineer approve this?\n3. Does it match the quality of examples in references?\n4. Are there any obvious gaps?\n5. Would I be confident defending this in review?\n\n### Honesty Check\n1. Did I skip anything to save time/tokens?\n2. Am I claiming completion without verification?\n3. Are there parts I'm uncertain about?\n\n## Reference Emphasis Mechanism\n\nTo ensure references are consulted:\n\n### Before Starting a Skill\n```\nâ”Œâ”€â”€â”€â”€â”€â”€â”€â”€â”€â”€â”€â”€â”€â”€â”€â”€â”€â”€â”€â”€â”€â”€â”€â”€â”€â”€â”€â”€â”€â”€â”€â”€â”€â”€â”€â”€â”€â”€â”€â”€â”€â”€â”€â”€â”€â”€â”€â”€â”€â”€â”€â”€â”€â”€â”€â”€â”€â”€â”€â”€â”€â”€â”€â”€â”€â”€â”€â”€â”€â”€â”€â”€â”€â”€â”€â”€â”€â”\nâ”‚  ğŸ” REFERENCE CHECK                                                          â”‚\nâ”‚                                                                             â”‚\nâ”‚  Before applying [skill], you MUST read:                                    â”‚\nâ”‚                                                                             â”‚\nâ”‚  â–¡ [reference-1.md] â€” [Why it's essential]                                  â”‚\nâ”‚  â–¡ [reference-2.md] â€” [Why it's essential]                                  â”‚\nâ”‚                                                                             â”‚\nâ”‚  Skipping references leads to:                                              â”‚\nâ”‚  â€¢ Incomplete application                                                   â”‚\nâ”‚  â€¢ Missing best practices                                                   â”‚\nâ”‚  â€¢ Rework during verification                                               â”‚\nâ”‚                                                                             â”‚\nâ”‚  Time investment: ~2-5 minutes reading                                      â”‚\nâ”‚  Value: Correct application, no rework                                      â”‚\nâ”‚                                                                             â”‚\nâ””â”€â”€â”€â”€â”€â”€â”€â”€â”€â”€â”€â”€â”€â”€â”€â”€â”€â”€â”€â”€â”€â”€â”€â”€â”€â”€â”€â”€â”€â”€â”€â”€â”€â”€â”€â”€â”€â”€â”€â”€â”€â”€â”€â”€â”€â”€â”€â”€â”€â”€â”€â”€â”€â”€â”€â”€â”€â”€â”€â”€â”€â”€â”€â”€â”€â”€â”€â”€â”€â”€â”€â”€â”€â”€â”€â”€â”€â”˜\n```\n\n### Reference Reading Protocol\n\n1. **Scan first** â€” Read headers and key points (30 seconds)\n2. **Deep read relevant sections** â€” Based on current context (1-2 minutes)\n3. **Extract actionable guidance** â€” Note what applies to current task\n4. **Apply during skill execution** â€” Reference while working\n5. **Verify against reference** â€” Check output matches guidance\n\n## Common Verification Failures\n\n| Failure | Cause | Prevention |\n|---------|-------|------------|\n| Missing deliverable | Forgot to create file | Check registry before marking complete |\n| Incomplete deliverable | Rushed, skipped sections | Use template, check all sections |\n| Skipped references | Token saving | Read references first, always |\n| Skipped steps | Assumed not needed | Follow all steps, note if N/A |\n| Low quality output | No self-review | Apply outcome quality questions |\n\n## Verification Cadence\n\n| Context | When to Verify |\n|---------|----------------|\n| **Tight loop** | After each skill (quick check) |\n| **Standard** | At stage boundaries |\n| **Review mode** | Full verification of all skills |\n| **Retrospective** | Complete journey audit |\n\n## Mode-Specific Behavior\n\nVerification requirements differ by orchestrator mode:\n\n### Greenfield Mode\n\n| Aspect | Behavior |\n|--------|----------|\n| **Scope** | Fullâ€”complete verification at each stage |\n| **Approach** | Comprehensiveâ€”full process compliance and outcome quality checks |\n| **Patterns** | Free choiceâ€”establish verification patterns |\n| **Deliverables** | Fullâ€”all required deliverables must exist |\n| **Validation** | Standardâ€”all required references must be consulted |\n| **Constraints** | Minimalâ€”block stage transitions on any verification failure |\n\n**Greenfield verification:**\n- Full process compliance check\n- Full outcome quality check\n- All deliverables required\n- Block stage transitions on failure\n\n### Brownfield-Polish Mode\n\n| Aspect | Behavior |\n|--------|----------|\n| **Scope** | Gap-specificâ€”focused on gaps and new/modified deliverables |\n| **Approach** | Extend existingâ€”verify compatibility with existing artifacts |\n| **Patterns** | Should matchâ€”follow existing verification patterns |\n| **Deliverables** | Deltaâ€”verify new/modified deliverables only |\n| **Validation** | Existing + newâ€”relevant references for gaps |\n| **Constraints** | Don't breakâ€”block only on critical gaps |\n\n**Polish verification:**\n- Verify gap remediation complete\n- Check new deliverables only\n- Verify compatibility with existing\n- Focus on \"did we make it better?\"\n\n**Polish considerations:**\n```markdown\n- [ ] Gaps identified in triage addressed\n- [ ] New deliverables follow existing patterns\n- [ ] Existing functionality not broken\n- [ ] Tests pass (existing + new)\n```\n\n### Brownfield-Enterprise Mode\n\n| Aspect | Behavior |\n|--------|----------|\n| **Scope** | Change-specificâ€”verify only what changed |\n| **Approach** | Surgicalâ€”minimal verification footprint |\n| **Patterns** | Must conform exactlyâ€”strict compliance with existing verification |\n| **Deliverables** | Change recordâ€”only change-related deliverables |\n| **Validation** | Full regressionâ€”CI/CD pipeline must pass |\n| **Constraints** | Requires approvalâ€”block on any CI/CD failure |\n\n**Enterprise verification:**\n- Verify specific change implemented\n- Verify no regressions\n- Verify CI/CD pipeline passes\n- Verify documentation updated\n\n**Enterprise verification checklist:**\n```markdown\n- [ ] Change implemented as specified\n- [ ] Existing tests still pass\n- [ ] New tests for changed code\n- [ ] CI/CD pipeline green\n- [ ] No regressions in affected areas\n- [ ] Documentation reflects change\n```\n\n### Verification Strictness by Mode\n\n| Aspect | Greenfield | Polish | Enterprise |\n|--------|------------|--------|------------|\n| **Blocking failures** | All | Critical only | CI/CD failures |\n| **Required deliverables** | Full set | Gaps only | Change-related |\n| **Reference checking** | Mandatory | Recommended | Optional |\n| **Quality bar** | High | Match existing | Zero regression |\n\nâ†’ See `references/verification-checklists.md` for skill-specific checklists",
  "references": [
    {
      "name": "verification-checklists.md",
      "path": "references/verification-checklists.md",
      "content": "# Verification Checklists\n\nSkill-specific verification checklists for quick self-audit.\n\n## Quick Verification (All Skills)\n\nBefore marking any skill complete:\n\n```\nâ–¡ Deliverable exists at expected location\nâ–¡ Deliverable is not empty\nâ–¡ No TODO/FIXME/placeholder content\nâ–¡ Follows expected format/template\nâ–¡ Would pass quick senior review\n```\n\n---\n\n## entry-portal\n\n```markdown\n## entry-portal Verification\n\n### Process\n- [ ] Received and documented raw input\n- [ ] Asked clarifying questions (or documented why not needed)\n- [ ] Classified as domain/system/feature\n- [ ] Decomposed into systems (or confirmed single system)\n- [ ] Generated FeatureSpec using spec skill\n- [ ] Added to system queue\n- [ ] Published to GitHub (or documented why skipped)\n\n### References Consulted\n- [ ] clarifying-questions.md\n- [ ] system-decomposition.md (if decomposing)\n- [ ] dream-state-template.md\n\n### Deliverables\n- [ ] dream-state.md exists\n- [ ] system-queue.json exists and valid\n- [ ] FEATURESPEC.md exists (via spec skill)\n\n### Quality\n- [ ] Dream state is inspiring and clear\n- [ ] Systems are MECE\n- [ ] Dependencies are identified\n- [ ] Queue is properly ordered\n```\n\n---\n\n## spec\n\n```markdown\n## spec Verification\n\n### Process\n- [ ] Structured against 18-section template\n- [ ] Assigned Spec ID\n- [ ] Numbered all capabilities (CAP-###)\n- [ ] Applied feedback framework (if applicable)\n- [ ] Senior engineer audit completed\n- [ ] All audit issues resolved in spec\n\n### References Consulted\n- [ ] 18-section-template.md\n- [ ] capability-format.md\n- [ ] feedback-framework.md (for UI features)\n\n### Deliverables\n- [ ] FEATURESPEC.md exists\n- [ ] Minimum 1500 lines (target 2000+)\n- [ ] All 18 sections present (or marked N/A with reason)\n\n### Quality\n- [ ] No placeholder code\n- [ ] Full implementations, not pseudocode\n- [ ] All capabilities have complete definitions\n- [ ] Compilation summary shows issues resolved\n```\n\n---\n\n## architect\n\n```markdown\n## architect Verification\n\n### Process\n- [ ] Understood requirements and NFRs\n- [ ] Identified components/services\n- [ ] Defined interfaces between components\n- [ ] Chose appropriate patterns\n- [ ] Documented key decisions as ADRs\n\n### References Consulted\n- [ ] architecture-patterns.md\n- [ ] architectural-drivers.md\n- [ ] adr-template.md\n\n### Deliverables\n- [ ] ARCHITECTURE.md or architecture section exists\n- [ ] At least 1 ADR for key decision\n- [ ] System diagram included\n\n### Quality\n- [ ] Components have clear boundaries\n- [ ] Interfaces are well-defined\n- [ ] Pattern choices are justified\n- [ ] Trade-offs are documented\n```\n\n---\n\n## architecture-review\n\n```markdown\n## architecture-review Verification\n\n### Process\n- [ ] Step 1: Established context\n- [ ] Step 2: Mapped current state\n- [ ] Step 3: Identified architectural drivers\n- [ ] Step 4: Evaluated against drivers\n- [ ] Step 5: Identified issues\n- [ ] Step 6: Prioritized findings\n- [ ] Step 7: Recommended actions\n\n### References Consulted\n- [ ] assessment-template.md\n- [ ] evaluation-dimensions.md\n- [ ] common-architecture-issues.md\n- [ ] red-flags-checklist.md\n\n### Deliverables\n- [ ] ARCHITECTURE-REVIEW.md exists\n- [ ] All 7 steps documented\n- [ ] Clear verdict (APPROVED/CONDITIONAL/REJECTED)\n\n### Quality\n- [ ] System diagram accurate\n- [ ] Driver evaluation has evidence\n- [ ] Issues have severity and remediation\n- [ ] Recommendations are actionable\n```\n\n---\n\n## implement\n\n```markdown\n## implement Verification\n\n### Process\n- [ ] Followed FEATURESPEC capability by capability\n- [ ] Wrote production-ready code (not stubs)\n- [ ] Included error handling\n- [ ] Wrote tests alongside (or immediately after)\n- [ ] Made incremental commits\n\n### References Consulted\n- [ ] service-layer-patterns.md\n- [ ] error-handling-patterns.md\n- [ ] testing-patterns.md\n\n### Deliverables\n- [ ] Source files exist in src/\n- [ ] All capabilities implemented\n- [ ] Tests exist in tests/\n\n### Quality\n- [ ] Code follows patterns from references\n- [ ] Error handling is comprehensive\n- [ ] No TODO/FIXME in production code\n- [ ] Types are complete (for typed languages)\n```\n\n---\n\n## test-generation\n\n```markdown\n## test-generation Verification\n\n### Process\n- [ ] Identified what to test (units, integrations, e2e)\n- [ ] Designed test cases for each level\n- [ ] Wrote tests covering happy paths\n- [ ] Wrote tests covering edge cases\n- [ ] Wrote tests covering error conditions\n\n### References Consulted\n- [ ] unit-test-patterns.md\n- [ ] integration-test-patterns.md (if applicable)\n- [ ] mocking-patterns.md (if using mocks)\n\n### Deliverables\n- [ ] Test files exist\n- [ ] Tests are runnable\n- [ ] Minimum coverage: 1 test per public function\n\n### Quality\n- [ ] Tests are fast and reliable\n- [ ] Tests are independent\n- [ ] Tests are readable (serve as documentation)\n- [ ] Edge cases covered\n```\n\n---\n\n## code-verification\n\n```markdown\n## code-verification Verification\n\n### Process\n- [ ] Checked complexity (O(nÂ²) patterns)\n- [ ] Checked security (injection, traversal)\n- [ ] Checked error handling\n- [ ] Checked resource management\n- [ ] Checked state management\n- [ ] Checked concurrency (if applicable)\n\n### References Consulted\n- [ ] complexity-patterns.md\n- [ ] error-handling-patterns.md\n- [ ] Relevant patterns for code type\n\n### Deliverables\n- [ ] VERIFICATION.md exists\n- [ ] All categories assessed\n- [ ] Clear PASS/PARTIAL/FAIL verdict\n\n### Quality\n- [ ] Evidence provided for each assessment\n- [ ] Issues have severity ratings\n- [ ] Accepted risks documented with rationale\n```\n\n---\n\n## code-validation\n\n```markdown\n## code-validation Verification\n\n### Process\n- [ ] Verified requirements coverage\n- [ ] Verified edge cases handled\n- [ ] Verified failure modes handled\n- [ ] Verified integration points\n\n### References Consulted\n- [ ] requirements-alignment.md\n- [ ] edge-cases.md\n- [ ] failure-modes.md\n\n### Deliverables\n- [ ] VALIDATION.md exists\n- [ ] All capabilities mapped to implementation\n- [ ] Coverage percentage documented\n\n### Quality\n- [ ] 100% capability coverage (or gaps explained)\n- [ ] Edge cases explicitly addressed\n- [ ] Failure modes have graceful handling\n```\n\n---\n\n## security-audit\n\n```markdown\n## security-audit Verification\n\n### Process\n- [ ] Reviewed OWASP Top 10\n- [ ] Identified attack surface\n- [ ] Threat modeled key flows\n- [ ] Tested for common vulnerabilities\n\n### References Consulted\n- [ ] owasp-top-10.md (ALWAYS)\n- [ ] vulnerability-patterns.md\n- [ ] remediation-patterns.md (if issues found)\n\n### Deliverables\n- [ ] Security section in VALIDATION.md\n- [ ] All OWASP categories addressed\n- [ ] Vulnerabilities documented with remediation\n\n### Quality\n- [ ] No critical vulnerabilities\n- [ ] All high vulnerabilities addressed\n- [ ] Security controls documented\n```\n\n---\n\n## code-review\n\n```markdown\n## code-review Verification\n\n### Process\n- [ ] Pass 1: Verification (structural)\n- [ ] Pass 2: Validation (semantic)\n- [ ] Pass 3: PR hygiene\n- [ ] Pass 4: Maintainability\n\n### References Consulted\n- [ ] maintainability-checklist.md\n- [ ] diff-analysis.md\n- [ ] feedback-formatting.md\n\n### Deliverables\n- [ ] CODE-REVIEW.md exists\n- [ ] All 4 passes documented\n- [ ] Clear verdict (APPROVE/REQUEST_CHANGES/COMMENT)\n\n### Quality\n- [ ] Issues categorized as blocking/non-blocking\n- [ ] Feedback is actionable\n- [ ] Positive aspects noted, not just issues\n```\n\n---\n\n## document\n\n```markdown\n## document Verification\n\n### Process\n- [ ] Identified audience\n- [ ] Determined document types needed\n- [ ] Wrote/updated README\n- [ ] Wrote/updated API docs\n- [ ] Wrote/updated other docs as needed\n\n### References Consulted\n- [ ] readme-templates.md\n- [ ] api-documentation.md\n- [ ] architecture-docs.md (if applicable)\n\n### Deliverables\n- [ ] README.md exists and is complete\n- [ ] API documentation exists (if applicable)\n- [ ] Other docs as identified\n\n### Quality\n- [ ] Docs are accurate (match code)\n- [ ] Quick start actually works\n- [ ] Examples are runnable\n```\n\n---\n\n## deploy\n\n```markdown\n## deploy Verification\n\n### Process\n- [ ] Selected deployment strategy\n- [ ] Created build artifacts\n- [ ] Wrote deployment documentation\n- [ ] Defined rollback procedure\n- [ ] Defined validation checklist\n\n### References Consulted\n- [ ] rollback-procedures.md\n\n### Deliverables\n- [ ] DEPLOY.md exists\n- [ ] Build artifacts created (or instructions to create)\n- [ ] Deployment verified working\n\n### Quality\n- [ ] Actually deployed/installed successfully\n- [ ] Validation checklist passes\n- [ ] Rollback tested or documented\n```\n\n---\n\n## memory-manager (Handoff)\n\n```markdown\n## memory-manager Handoff Verification\n\n### Process\n- [ ] Created handoff document\n- [ ] Included session metadata\n- [ ] Documented completed work\n- [ ] Documented current state\n- [ ] Listed decisions made\n- [ ] Identified blockers/issues\n- [ ] Defined next steps\n\n### References Consulted\n- [ ] handoff-template.md\n\n### Deliverables\n- [ ] sessions/{date}-{system}.md exists\n- [ ] All handoff sections complete\n\n### Quality\n- [ ] Another agent could resume from this\n- [ ] No assumed context\n- [ ] Commands to run are specific\n```\n\n---\n\n## Aggregate Verification\n\nWhen verifying multiple skills at a stage gate:\n\n```markdown\n## Stage Gate Verification: [Stage Name]\n\n### Skills Applied in Stage\n| Skill | Deliverable | Status |\n|-------|-------------|--------|\n| | | |\n\n### Overall Assessment\n- [ ] All required skills applied\n- [ ] All deliverables exist\n- [ ] All verifications pass\n- [ ] Ready to proceed to next stage\n\n### Gaps Requiring Remediation\n| Skill | Gap | Action |\n|-------|-----|--------|\n| | | |\n```\n"
    }
  ],
  "tags": [
    "meta",
    "verification",
    "quality",
    "audit"
  ],
  "dependsOn": []
}